[
  {
    "id": "remoteok-59087f3d174d",
    "title": "IT Support Specialist",
    "company": "Unknown",
    "location": "Remote",
    "is_remote": true,
    "salary_min": null,
    "salary_max": null,
    "salary_text": null,
    "description": "Napost noong 1:43:44 PM. We are looking for a skilled and reliable IT Support Specialist to join our growing remote team…Makita ito at kahalintulad na mga trabaho sa LinkedIn.",
    "description_short": "Napost noong 1:43:44 PM. We are looking for a skilled and reliable IT Support Specialist to join our growing remote team…Makita ito at kahalintulad na mga trabaho sa LinkedIn.",
    "url": "https://remoteOK.com/remote-jobs/remote-it-support-specialist-remoteva-1132230",
    "source": "RemoteOK",
    "source_id": null,
    "date_posted": "2026-05-25T22:06:16+00:00",
    "date_scraped": "2026-05-27",
    "tags": [
      "remote",
      "support"
    ],
    "required_skills": [],
    "experience_level": "any",
    "role_type": "support",
    "employment_type": "full-time",
    "flags": {
      "has_drug_test": false,
      "is_senior": false,
      "is_hidden": false,
      "is_duplicate": false,
      "match_score": 0
    },
    "status": "new",
    "application_id": null
  },
  {
    "id": "weworkremotely-cab4654913f2",
    "title": "QA Engineer",
    "company": "Cortes 23",
    "location": "Remote",
    "is_remote": true,
    "salary_min": 80000,
    "salary_max": null,
    "salary_text": null,
    "description": "Headquarters: Remote URL: https://cortes23.com Are you an experienced QA engineer with a proven record of success, looking for a new and exciting challenge? Do you want to be part of an industry disruptor? If so, we could have the opportunity for you. The role requires an experienced QA engineer who can tackle technical challenges in a fast moving environment. You will work closely with the CTO to plan, develop and execute test strategies that result in the delivery of a robust product. As we grow, the opportunity to grow into a lead role will be available. We dont believe that automated testing is the only way to release robust software. Therefore, we are looking for someone that can design and implement automated and manual testing processes internally. Compensation range: $55,000 - $80,000 USD Senior QA Engineer Responsibilities Plan, develop and execute product quality strategies and ensure product correctness before launch. Work closely with the CTO to collect necessary information about the QA of the product, and also provide feedback on quality issues. Leverage automation for scalable solutions to prevent regressions and ensure reliability of the product. Minimum Qualifications Bachelor's degree in Computer Science, Computer Engineering, relevant technical field, or equivalent practical experience. Experience of industry standard test automation tools & automation frameworks. 4+ years of quality Engineering and/or test engineering experience. Hands-on experience with planning, designing, executing tests and knowledge of performance and stress testing. Experience in project management approaches, tools and phases of a project life cycle. Experience implementing and maintaining quality test automation for both RESTful APIs and web applications. Experience in JavaScript, TypeScript or equivalent coding language. Preferred Qualifications Experience being creative and having initiative to improve product quality coverage and effectiveness. Experience thriving in an ambiguous environment that demands constant self-prioritization. Understanding of the Event-Driven and Serverless architecture. Experience with ETL/ELT product testing. Familiarity with cloud environments (AWS, Azure, GCP). What we offer Remote forever! Flexible work hours. Unlimited",
    "description_short": "Headquarters: Remote URL: https://cortes23.com Are you an experienced QA engineer with a proven record of success, looking for a new and exciting challenge? Do you want to be part of an industry disruptor? If so, we could have the opportunity for you. </d",
    "url": "https://weworkremotely.com/remote-jobs/cortes-23-qa-engineer",
    "source": "WeWorkRemotely",
    "source_id": null,
    "date_posted": "Tue, 26 May 2026 22:01:21 +0000",
    "date_scraped": "2026-05-27",
    "tags": [
      "javascript",
      "remote",
      "typescript"
    ],
    "required_skills": [],
    "experience_level": "senior",
    "role_type": "backend",
    "employment_type": "full-time",
    "flags": {
      "has_drug_test": false,
      "is_senior": false,
      "is_hidden": false,
      "is_duplicate": false,
      "match_score": 0
    },
    "status": "new",
    "application_id": null
  },
  {
    "id": "weworkremotely-3179d36f1105",
    "title": "Catalog Analyst",
    "company": "Podean",
    "location": "Remote",
    "is_remote": true,
    "salary_min": null,
    "salary_max": null,
    "salary_text": null,
    "description": "Headquarters: Brazil URL: http://podean.com Podean is a leading marketplace agency helping brands accelerate growth across Amazon, Walmart, Target, TikTok Shop, and other digital commerce platforms. We combine strategic expertise, data-driven insights, and creative innovation to deliver measurable business outcomes for our clients. As a Marketplace Catalog Analyst , you will be responsible for creating, curating, and optimizing the global catalog, ensuring consistency, accuracy, and relevance across all platforms. You will work closely with internal stakeholders, track content performance, and implement strategic improvements to enhance brand visibility, drive conversions, and maximize audience engagement. What You'll Do Work with the Podean Listing tool to fill marketplace templates Fulfill the images requirement for each marketplace using (Salsify and Malibu) Ensure compliance with platform policies and best practices What We're Looking For 2-3 years of catalog experience in Liverpool, Amazon, and/or Mercado Libre Strong understanding of e-commerce business models and a passion for online retail Ability to independently prioritize tasks and manage multiple projects efficiently Advanced Excel proficiency, including data analysis and formula application Exceptional attention to detail and a highly organized approach to work Strong analytical skills, with the ability to interpret data and optimize marketplace strategies Excellent teamwork and collaboration skills in a fast-paced environment Resume and application must be submitted in English strong written English communication is essential for this role Why Join Podean? Podean is proud to be recognized as one of Digidays Best Employers for Remote Employees . We combine the energy of a fast-growing global agency with the balance and trust of a remote-first culture. Youll join a globally connected, award-winning team that values: Competitive compensation aligned to experience and market benchmarks Remote-first flexibility - work from anywhere, with trust and autonomy Global collaboration - working with experts across regions and time zones Career growth and development - opportunities to evolve as we scale 5-Year Sabbatical + Travel Stipend - After your 5-year anniversary, take a fully paid month-long sabbatical, plus a travel reimbursement to make your experience restorative and inspiring Positive-energy culture - grounded i",
    "description_short": "Headquarters: Brazil URL: http://podean.com Podean is a leading marketplace agency helping brands accelerate growth across Amazon, Walmart, Target, TikTok Shop, and other digital commerce platforms. We combine strategic expertise, data-driven insights, and creative innovation to deliver measurable business outcomes for our clients. As a Marketplace Catalog Analyst</s",
    "url": "https://weworkremotely.com/remote-jobs/podean-catalog-analyst",
    "source": "WeWorkRemotely",
    "source_id": null,
    "date_posted": "Tue, 26 May 2026 17:33:00 +0000",
    "date_scraped": "2026-05-27",
    "tags": [
      "remote",
      "support",
      "typescript"
    ],
    "required_skills": [],
    "experience_level": "any",
    "role_type": "devops",
    "employment_type": "full-time",
    "flags": {
      "has_drug_test": false,
      "is_senior": false,
      "is_hidden": false,
      "is_duplicate": false,
      "match_score": 0
    },
    "status": "new",
    "application_id": null
  }
]