[
  {
    "id": "remoteok-be0804aa564f",
    "title": "Curriculum Developer",
    "company": "Unknown",
    "location": "Remote",
    "is_remote": true,
    "salary_min": null,
    "salary_max": null,
    "salary_text": null,
    "description": "About The Job Mercor connects elite creative and technical talent with leading AI research labs. Headquartered in San Francisco, our investors include Benchmark , General Catalyst , Peter Thiel , Adam D'Angelo , Larry Summers , and Jack Dorsey . Position: Education Expert Type: Contract Compensation: $50/hour Location: Remote Role Responsibilities Evaluate the accuracy and depth of AI-generated content in Mathematics to strengthen reasoning and rigor in model outputs. Review complex mathematical content for alignment with domain principles and methodologies. Provide clear, structured feedback to AI research teams to improve training data quality and downstream performance. Develop evaluation rubrics and benchmarks for assessing AI-generated mathematical tasks and solutions. Collaborate with subject matter experts to ensure consistency, relevance, and coverage across datasets. Work independently and asynchronously to meet deadlines while improving AI model performance. Qualifications Must-Have 5+ years of experience in Mathematics education or related field. Proficiency in AI model evaluation and improvement. Strong understanding of mathematical principles and methodologies. Application Process (Takes 20–30 mins to complete) Upload resume AI interview based on your resume Submit form Resources & Support For details about the interview process and platform information, please check: https://talent.docs.mercor.com/welcome For any help or support, reach out to: support@mercor.com PS: Our team reviews applications daily. Please complete your AI interview and application steps to be considered for this opportunity.",
    "description_short": "About The Job Mercor connects elite creative and technical talent with leading AI research labs. Headquartered in San Francisco, our investors include Benchmark , General Catalyst , Peter Thiel , Adam D'Angelo , Larry Summers , and Jack Dorsey . Position: Education Expert Type: Contract <st",
    "url": "https://remoteOK.com/remote-jobs/remote-curriculum-developer-mercor-1132151",
    "source": "RemoteOK",
    "source_id": null,
    "date_posted": "2026-05-23T20:18:37+00:00",
    "date_scraped": "2026-05-25",
    "tags": [
      "remote",
      "support",
      "typescript"
    ],
    "required_skills": [],
    "experience_level": "senior",
    "role_type": "devops",
    "employment_type": "full-time",
    "flags": {
      "has_drug_test": false,
      "is_senior": false,
      "is_hidden": false,
      "is_duplicate": false,
      "match_score": 0
    },
    "status": "new",
    "application_id": null
  },
  {
    "id": "remoteok-876b331d683e",
    "title": "IT Support Specialist",
    "company": "Unknown",
    "location": "Remote",
    "is_remote": true,
    "salary_min": null,
    "salary_max": null,
    "salary_text": null,
    "description": "We are looking for a skilled and reliable IT Support Specialist to join our growing remote team…",
    "description_short": "We are looking for a skilled and reliable IT Support Specialist to join our growing remote team…",
    "url": "https://remoteOK.com/remote-jobs/remote-it-support-specialist-remoteva-1131875",
    "source": "RemoteOK",
    "source_id": null,
    "date_posted": "2026-05-23T11:08:05+00:00",
    "date_scraped": "2026-05-25",
    "tags": [
      "remote",
      "support"
    ],
    "required_skills": [],
    "experience_level": "any",
    "role_type": "support",
    "employment_type": "full-time",
    "flags": {
      "has_drug_test": false,
      "is_senior": false,
      "is_hidden": false,
      "is_duplicate": false,
      "match_score": 0
    },
    "status": "new",
    "application_id": null
  },
  {
    "id": "remoteok-e4558b5e7a93",
    "title": "Chat Support Clerk",
    "company": "Unknown",
    "location": "Remote",
    "is_remote": true,
    "salary_min": null,
    "salary_max": null,
    "salary_text": null,
    "description": "We are seeking a compassionate, organized, and professional Chat Support Clerk to join our growing remote team at Positive Behavior Steps. In this role you will serve as a key point of digital contact for our clients, families, and partners providing timely, accurate, and empathetic support through our live chat platform. Your communication skills, attention to detail, and genuine passion for helping others will directly reflect the mission and values of our organization. Location: United States (Remote). Key Responsibilities Respond promptly and professionally to inbound client and family inquiries via live chat. Provide accurate information about Positive Behavior Steps' programs, services, and support offerings. Assist clients and families with appointment scheduling, service inquiries, and program navigation. Process and document incoming chat requests, service orders, and client information accurately. Resolve client concerns and complaints with empathy, patience, and professionalism. Accurately log all chat interactions and maintain up-to-date client records in the CRM system. Coordinate with clinical, administrative, and operations teams to escalate and resolve complex client needs. Follow up with clients to confirm resolution and ensure overall satisfaction. Maintain up-to-date knowledge of Positive Behavior Steps' programs, policies, and behavioral health resources. Identify opportunities to improve the client experience and communicate feedback to management. Handle all client information with the highest level of confidentiality and in compliance with HIPAA and applicable privacy regulations. Meet or exceed performance targets including response time, resolution rate, and client satisfaction scores. Provide additional clerical and administrative support to the team as required. Qualifications & Skills High school diploma or equivalent required; degree or certification in healthcare, behavioral health, communications, or a related field is a plus. 0–2 years of experience in customer service, chat support, clerical work, or a healthcare related role. Excellent written communication skills with a warm, empathetic, and professional tone. Strong multitasking ability with the capacity to manage multiple chat conversations simultaneously. Proficiency with live chat platforms, CRM software, and Microsoft Office Suite. Excellent typing speed and accuracy with a minimum of 40–50 WPM. Knowledge of behavioral health, mental health, or social services is highly desirable. Strong problem-solving skills with a genuine passion for client satisfaction and well-being. Comfortable discussing behavioral health topics in a professional, sensitive, and supportive manner. Rel",
    "description_short": "We are seeking a compassionate, organized, and professional Chat Support Clerk to join our growing remote team at Positive Behavior Steps. In this role you will serve as a key point of digital contact for our clients, families, and partners providing timely, accurate, and empathetic support through our live chat platform. Your communication skills, attention to detail, and genuine passion for helping others will directly reflect the mission and values of our organization. Location",
    "url": "https://remoteOK.com/remote-jobs/remote-chat-support-clerk-positive-behavior-steps-1132142",
    "source": "RemoteOK",
    "source_id": null,
    "date_posted": "2026-05-23T06:00:00+00:00",
    "date_scraped": "2026-05-25",
    "tags": [
      "remote",
      "support",
      "typescript"
    ],
    "required_skills": [],
    "experience_level": "any",
    "role_type": "devops",
    "employment_type": "full-time",
    "flags": {
      "has_drug_test": false,
      "is_senior": false,
      "is_hidden": false,
      "is_duplicate": false,
      "match_score": 0
    },
    "status": "new",
    "application_id": null
  }
]