[
  {
    "id": "remoteok-79ae23f0ea4b",
    "title": "AP Operations Analyst",
    "company": "Unknown",
    "location": "Remote",
    "is_remote": true,
    "salary_min": null,
    "salary_max": null,
    "salary_text": null,
    "description": "Note: This is for active pooling purposes only. Submitting your application does not guarantee employment. Your details will be kept on file and considered for future opportunities as they become available. We are seeking a detail-oriented and process-driven Operations Analyst (Australian SMSF) to join our team. In this remote role, you will be responsible for supporting the day-to-day administration and operational processing of Self-Managed Super Funds (SMSFs) for Australian clients. You will assist with fund maintenance, transaction processing, reconciliations, compliance support, and audit preparation while ensuring accuracy and adherence to Australian regulatory requirements. Experience working with Australian SMSFs and platforms such as BGL Simple Fund 360 or Class Super is highly preferred. Position: Operations Analyst (Australian SMSF) Salary: PHP 60,000 - PHP 80,000/month (flexible for more experienced candidates) Working Hours & Conditions: Mondays to Fridays, AU Business Hours; full-time (remote) Holidays: TBD Responsibilities: 2+ years experience in SMSF Operations, SMSF Administration, Superannuation Administration, Fund Administration, or Financial Services Operations. Experience processing high-volume transactions and routine operational tasks. Experience using BGL Simple Fund 360, Class Super, SuperMate, or similar platforms. Strong attention to detail and process adherence. Comfortable working within structured workflows and SOP-driven environments. Experience supporting Australian financial services, accounting, or SMSF firms is highly preferred. Strong data entry, reconciliation, and records management skills. Excellent organizational and time management skills. Qualifications: Experience: 2+ years of experience in SMSF administration, superannuation operations, fund administration, or related Australian financial services roles. Experience supporting Australian SMSF clients is highly preferred. Familiarity with Australian superannuation and SMSF processes. Experience using BGL Simple Fund 360, Class Super, SuperMate, or similar SMSF platforms. Strong understanding of reconciliations, transaction processing, and financial record maintenance. Proficient in Microsoft Excel and other business applications. Attention to Detail: High level of accuracy and attention to detail. Organization: Ability to manage multiple tasks and meet deadlines in a fast-paced environment. Communication: Strong verbal and written English communication skills. Confidentiality: Ability to handle sensitive financial information with discretion. Problem Solving: Strong analytical and troubleshooting skills. Experience working remotely with Australian accounting, SMSF, or financial services firms is advantageous. Be",
    "description_short": "Note: This is for active pooling purposes only. Submitting your application does not guarantee employment. Your details will be kept on file and considered for future opportunities as they become available. We are seeking a detail-oriented and process-driven Operations Analyst (Australian SMSF) to join our team. In this remote role, you will be responsible for supporting the day-to-day administration and operational processing of Self-Managed Super Funds (SMSFs) for Australian clie",
    "url": "https://remoteOK.com/remote-jobs/remote-ap-operations-analyst-d2b-1133421",
    "source": "RemoteOK",
    "source_id": null,
    "date_posted": "2026-06-15T14:00:04+00:00",
    "date_scraped": "2026-06-16",
    "tags": [
      "remote",
      "support",
      "typescript"
    ],
    "required_skills": [],
    "experience_level": "any",
    "role_type": "devops",
    "employment_type": "full-time",
    "flags": {
      "has_drug_test": false,
      "is_senior": false,
      "is_hidden": false,
      "is_duplicate": false,
      "match_score": 0
    },
    "status": "new",
    "application_id": null
  }
]